{
  "contract": "ara.component-manifest",
  "version": "0.2.0",
  "componentId": "org.ara.prototype.source-argument",
  "release": "0.2.0",
  "family": "source-argument",
  "schemas": {
    "representation": "source-argument.schema.json#/$defs/representation",
    "activity": "source-argument.schema.json#/$defs/activity",
    "response": "source-argument.schema.json#/$defs/response",
    "validator": "source-argument.schema.json#/$defs/validator",
    "feedback": "common.schema.json#/$defs/feedbackContract"
  },
  "capabilities": {
    "responseModes": [
      "annotation-set",
      "argument-graph"
    ],
    "validatorModes": [
      "deterministic",
      "human-review",
      "probabilistic-assistance"
    ],
    "determinism": "mixed-authority",
    "rendererGeometryCanonical": false
  },
  "derivedStatePolicy": {
    "recomputable": true,
    "cacheLifetime": "session",
    "canonicalForbiddenFields": [
      "layout",
      "x",
      "y",
      "position",
      "rendererState",
      "workerHandle",
      "libraryObject"
    ],
    "notes": "Renderer and runtime state are disposable and never authoritative."
  },
  "runtimeRequirements": {
    "kind": "human-review",
    "validationLocations": [
      {
        "kind": "client-public",
        "authority": "deterministic-validator",
        "required": true,
        "capabilityId": "selector-integrity"
      },
      {
        "kind": "human-review",
        "authority": "human-review",
        "required": true,
        "capabilityId": "argument-rubric"
      },
      {
        "kind": "probabilistic-assistance",
        "authority": "probabilistic-assistance",
        "required": false,
        "capabilityId": "language-suggestions"
      }
    ],
    "isolationAssurance": "none",
    "productionEligibility": "conditionally-eligible",
    "limits": {
      "timeMs": null,
      "memoryMiB": null,
      "outputBytes": 65536,
      "outputMessages": 128,
      "cancellationRequired": false,
      "network": "none",
      "filesystem": "none"
    }
  },
  "securityBoundary": {
    "courseSuppliedCode": "forbidden",
    "learnerCode": "data-only",
    "trustedComponentCode": "installed-approved-adapter",
    "sensitiveData": "forbidden"
  },
  "accessibility": {
    "operations": [
      {
        "operation": "select-source-range",
        "keyboard": "Keyboard range selection or explicit start/end controls.",
        "nonvisual": "Quote-context selector can be created through a linear form.",
        "statusAnnouncement": "Announce selected quote and resolution state.",
        "focusManagement": "Move to annotation body after confirmation.",
        "reflow": "Source and form reflow.",
        "knownLimits": [
          "Native range selection differs across assistive technologies."
        ]
      },
      {
        "operation": "link-evidence",
        "keyboard": "Choose source annotation and argument node through controls.",
        "nonvisual": "Relations are exposed as a linear list.",
        "statusAnnouncement": "Announce created relation.",
        "focusManagement": "Restore focus to relation controls.",
        "reflow": "Linear relation editor reflows.",
        "knownLimits": []
      }
    ],
    "textAlternative": "Sources, annotations and argument relations require linear text equivalents.",
    "knownLimits": [
      "Overlapping annotations require later specialist validation."
    ]
  },
  "offlineProfile": {
    "grade": "full",
    "networkDuringStudy": "forbidden",
    "packageRequirements": [
      "source-annotation-adapter"
    ],
    "limitations": [
      "Human review can be queued and synchronized later."
    ]
  },
  "measuredPackageProfile": {
    "status": "not-measured",
    "method": "No external runtime bundled in the contract package.",
    "environment": "schema-level contract package",
    "limitations": [
      "Candidate adapter measurements are stored separately."
    ]
  },
  "validationEvidencePolicy": {
    "defaultVisibility": "learner",
    "retention": "attempt",
    "redactionRequired": true,
    "protectedKinds": [
      "protected-tests",
      "review-notes",
      "probabilistic-trace",
      "security-diagnostics"
    ]
  },
  "localization": {
    "uiLocales": [
      "pt-BR",
      "pt-PT",
      "en"
    ],
    "authoredContentLanguageMetadata": "required",
    "translatableInterfaceStringsSeparate": true
  },
  "provenance": {
    "authority": "project-authored",
    "createdAt": "2026-08-03T04:45:00Z",
    "sourceIds": [
      "SYS19",
      "SYS20",
      "PR39"
    ],
    "license": "CC-BY-4.0"
  }
}
